<?xml version="1.0" encoding="UTF-8"?>
<!-- edited with XMLSpy v2011 (http://www.altova.com) by wangqzh (yonyou) -->
<xs:schema xmlns:xs="http://www.w3.org/2001/XMLSchema" elementFormDefault="qualified" attributeFormDefault="unqualified">
	<xs:element name="configure">
		<xs:annotation>
			<xs:documentation>Comment describing your root element</xs:documentation>
		</xs:annotation>
		<xs:complexType>
			<xs:sequence>
				<xs:element name="categories">
					<xs:complexType>
						<xs:sequence>
							<xs:element name="category" minOccurs="0" maxOccurs="unbounded">
								<xs:complexType>
									<xs:attribute name="code" type="xs:string"/>
									<xs:attribute name="name" type="xs:string"/>
								</xs:complexType>
							</xs:element>
						</xs:sequence>
					</xs:complexType>
				</xs:element>
				<xs:element name="types">
					<xs:complexType>
						<xs:sequence>
							<xs:element name="type" minOccurs="0" maxOccurs="unbounded">
								<xs:complexType>
									<xs:attribute name="code" type="xs:string"/>
									<xs:attribute name="name" type="xs:string"/>
								</xs:complexType>
							</xs:element>
						</xs:sequence>
					</xs:complexType>
				</xs:element>
				<xs:element name="charts" minOccurs="1">
					<xs:complexType>
						<xs:sequence>
							<xs:element name="chart" minOccurs="0" maxOccurs="unbounded">
								<xs:complexType>
									<xs:attribute name="code" type="xs:string" use="required"/>
									<xs:attribute name="name" type="xs:string" use="required"/>
									<xs:attribute name="category" type="xs:string" use="required"/>
									<xs:attribute name="type" type="xs:string" use="required"/>
									<xs:attribute name="icon" type="xs:string" use="required"/>
									<xs:attribute name="path" type="xs:string" use="optional"/>
									<xs:attribute name="enable" type="xs:boolean" default="true"/>
									<xs:attribute name="description" type="xs:string" use="optional"/>
								</xs:complexType>
							</xs:element>
						</xs:sequence>
					</xs:complexType>
				</xs:element>
				<xs:element name="drivers">
					<xs:complexType>
						<xs:sequence>
							<xs:element name="parsers" minOccurs="0">
								<xs:complexType>
									<xs:sequence>
										<xs:element name="parser" minOccurs="0" maxOccurs="unbounded">
											<xs:complexType>
												<xs:attribute name="code" type="xs:string" use="required"/>
												<xs:attribute name="name" type="xs:string" use="required"/>
												<xs:attribute name="type" type="xs:string" use="required"/>
												<xs:attribute name="class" type="xs:string" use="required"/>
											</xs:complexType>
										</xs:element>
									</xs:sequence>
									<xs:attribute name="name" type="xs:string" default=""/>
									<xs:attribute name="enable" type="xs:boolean" default="true"/>
								</xs:complexType>
							</xs:element>
							<xs:element name="generators" minOccurs="0">
								<xs:complexType>
									<xs:sequence>
										<xs:element name="generator" minOccurs="0" maxOccurs="unbounded">
											<xs:complexType>
												<xs:attribute name="code" type="xs:string" use="required"/>
												<xs:attribute name="name" type="xs:string" use="required"/>
												<xs:attribute name="type" type="xs:string" use="required"/>
												<xs:attribute name="class" type="xs:string" use="required"/>
											</xs:complexType>
										</xs:element>
									</xs:sequence>
									<xs:attribute name="name" type="xs:string" default=""/>
									<xs:attribute name="enable" type="xs:boolean" default="true"/>
								</xs:complexType>
							</xs:element>
						</xs:sequence>
					</xs:complexType>
				</xs:element>
			</xs:sequence>
			<xs:attribute name="version" type="xs:string" use="required"/>
		</xs:complexType>
	</xs:element>
</xs:schema>
